{
  "schema_version": "1.0.0",
  "csc_id": "csc_demo_0001",
  "issued_at": "2025-12-27T00:00:00Z",
  "expires_at": "2026-06-26T00:00:00+00:00",
  "status": "active",
  "issuer": {
    "org_id": "accesspod.registry",
    "name": "Access PoD Registry",
    "key_id": "kid-demo-001",
    "contact": {
      "email": "registry@policyofdevelopments.org",
      "web": "https://policyofdevelopments.org"
    }
  },
  "subject": {
    "subject_id": "subject_demo_agent_runtime",
    "name": "Demo Agent Runtime Gateway",
    "type": "service",
    "owner": {
      "org_id": "demo.org",
      "name": "Demo Org"
    },
    "version": "2025.12.26"
  },
  "scope": {
    "ai_types": [
      "LLM",
      "agentic"
    ],
    "deployment": "hybrid",
    "jurisdictions": [
      "AU",
      "EU"
    ],
    "sectors": [
      "public"
    ],
    "risk_tier_declared": "medium",
    "use_constraints": [
      "No autonomous high-impact decisions without human review."
    ]
  },
  "assessment": {
    "sapp": {
      "maturity_level": 4,
      "run_id": "sapp_run_demo_001",
      "run_at": "2025-12-26T00:00:00+00:00",
      "environment": "simulation"
    },
    "factor_scores": {
      "f6_1": {
        "score": 82.0,
        "confidence": 0.86,
        "telemetry_window": {
          "start": "2025-12-26T00:00:00+00:00",
          "end": "2025-12-26T00:00:00+00:00"
        },
        "top_metrics": [
          {
            "metric_id": "SEC_ATTACK_DETECT_RATE",
            "value": 0.94,
            "unit": "ratio",
            "weight": 0.1,
            "normalized": 0.76,
            "direction": "higher_is_better"
          }
        ]
      },
      "f6_2": {
        "score": 78.0,
        "confidence": 0.84,
        "telemetry_window": {
          "start": "2025-12-26T00:00:00+00:00",
          "end": "2025-12-26T00:00:00+00:00"
        },
        "top_metrics": [
          {
            "metric_id": "HARD_REDTEAM_PASS_RATE",
            "value": 0.9,
            "unit": "ratio",
            "weight": 0.1,
            "normalized": 0.71,
            "direction": "higher_is_better"
          }
        ]
      },
      "f6_3": {
        "score": 80.0,
        "confidence": 0.88,
        "telemetry_window": {
          "start": "2025-12-26T00:00:00+00:00",
          "end": "2025-12-26T00:00:00+00:00"
        },
        "top_metrics": [
          {
            "metric_id": "COMP_POLICY_TRACE_COVERAGE",
            "value": 0.93,
            "unit": "ratio",
            "weight": 0.1,
            "normalized": 0.8,
            "direction": "higher_is_better"
          }
        ]
      },
      "f6_4": {
        "score": 85.0,
        "confidence": 0.83,
        "telemetry_window": {
          "start": "2025-12-26T00:00:00+00:00",
          "end": "2025-12-26T00:00:00+00:00"
        },
        "top_metrics": [
          {
            "metric_id": "GOV_HIL_REVIEW_COVERAGE",
            "value": 0.92,
            "unit": "ratio",
            "weight": 0.12,
            "normalized": 0.8,
            "direction": "higher_is_better"
          }
        ]
      },
      "f6_5": {
        "score": 76.0,
        "confidence": 0.8,
        "telemetry_window": {
          "start": "2025-12-26T00:00:00+00:00",
          "end": "2025-12-26T00:00:00+00:00"
        },
        "top_metrics": [
          {
            "metric_id": "TRN_DECISION_TRACE_RATE",
            "value": 0.91,
            "unit": "ratio",
            "weight": 0.1,
            "normalized": 0.74,
            "direction": "higher_is_better"
          }
        ]
      },
      "f6_6": {
        "score": 74.0,
        "confidence": 0.78,
        "telemetry_window": {
          "start": "2025-12-26T00:00:00+00:00",
          "end": "2025-12-26T00:00:00+00:00"
        },
        "top_metrics": [
          {
            "metric_id": "SECTOR_POLICY_PASS_RATE",
            "value": 0.86,
            "unit": "ratio",
            "weight": 0.1,
            "normalized": 0.58,
            "direction": "higher_is_better"
          }
        ]
      }
    },
    "weights": {
      "profile_id": "sector.public.v1",
      "f6_1": 0.18,
      "f6_2": 0.12,
      "f6_3": 0.16,
      "f6_4": 0.26,
      "f6_5": 0.16,
      "f6_6": 0.12
    },
    "composite_score": 80.8,
    "csc_level": 4,
    "risk_tier": "medium",
    "gates": {
      "no_critical_failures": true,
      "telemetry_minimum_met": true,
      "f6_1_min_met": true,
      "f6_4_min_met": true,
      "all_factors_min_met": true,
      "sector_validation_met": false
    },
    "iso_alignment": {
      "iso_iec_42001": {
        "status": "partial",
        "notes": "Management-system controls mapped; not yet audited.",
        "controls_mapped": [
          "AIMS-roles",
          "AIMS-improvement-loop"
        ]
      },
      "iso_iec_23894": {
        "status": "aligned",
        "notes": "Risk assessment and treatment implemented in SAPP runs.",
        "controls_mapped": [
          "risk-identify",
          "risk-treat",
          "risk-monitor"
        ]
      },
      "iso_iec_22989": {
        "status": "aligned",
        "notes": "Terminology aligned to ISO concepts within policy objects.",
        "controls_mapped": [
          "ai-system",
          "ai-model",
          "inference",
          "training"
        ]
      }
    }
  },
  "evidence": {
    "bundle_id": "bundle_demo_001",
    "digest_alg": "sha256",
    "digest": "0000000000000000000000000000000000000000000000000000000000000000",
    "items": [
      {
        "type": "telemetry_export",
        "uri": "https://policyofdevelopments.org/downloads/json/demo/telemetry_export.json",
        "digest_alg": "sha256",
        "digest": "0000",
        "content_type": "application/json",
        "created_at": "2025-12-26T00:00:00+00:00"
      }
    ]
  },
  "signature": {
    "alg": "EdDSA",
    "kid": "kid-demo-001",
    "canonicalization": "JCS",
    "signed_payload_digest": {
      "digest_alg": "sha256",
      "digest": "0000"
    },
    "signature": "<base64url-signature>",
    "signed_at": "2025-12-26T00:00:00+00:00"
  },
  "links": {
    "registry_entry": "https://policyofdevelopments.org/registry/csc_demo_0001",
    "verification_endpoint": "https://policyofdevelopments.org/api/csc/verify",
    "public_report": "https://policyofdevelopments.org/reports/csc_demo_0001"
  }
}